{
  "schema_version": "1.0.0",
  "correlation_id": "pr-00000042",
  "repository": "Mindclade/mindclade",
  "actor": "mindclade-renovate[bot]",
  "event_name": "pull_request",
  "ref": "refs/heads/feature/trusted-contributor",
  "source_revision": "1111111111111111111111111111111111111111",
  "base_revision": "2222222222222222222222222222222222222222",
  "workflow_ref": ".github/workflows/pr-metadata.yml",
  "workflow_revision": "3333333333333333333333333333333333333333",
  "fork": false,
  "ref_protected": false,
  "source_trust": "trusted",
  "execution_tier": "untrusted"
}
